id	subreddit	network_tie_strength	parent_text	text
mr6dgu9	linux	strong-tie	Drifting farther away from the topic, if you are at all familiar with [Chimera Linux](https://chimera-linux.org/), how would you position what you are working on next to Chimera?	similar, in a way. If Chimera is the BSDified Linux, then FractalUX is the (re)-Unixified Linux. Chimera's about the only distro that doesn't annoy the fuck out of us, though we don't like APK much
msxh1ze	worldnews	weak-tie	[Context Not Found]	"It’s been give hours already and no one’s said it?

*Fuck Putin!*"
msn6jab	Parenting	strong-tie	[Context Not Found]	Uh, I’d be out. If any man touched my child like that, I don’t give a fuck if it was her dad, I’d be out. He should absolutely not be around your child. Leave. Take him to court. Get custody of your child.
mnwds7y	MechanicalKeyboards	strong-tie	[Context Not Found]	What the fuck is this advertising lmao
mswqi4e	pics	weak-tie	[Context Not Found]	"""Fuck Donald, right? Fuck Joe Biden, yeah? Fuck that fat poof Vance that hangs out with him. Fuck your face, yeah, yeah? And fuck the fucking lot of you all!"
ms5049z	Parenting	strong-tie	[Context Not Found]	I mean I think if someone approached me at the park and asked me to prove that my kids are mine I’d tell them to go fuck themselves.
msup56m	pics	weak-tie	[Context Not Found]	"Correct. This is absolutely no less weird/cringe than all the ""Fuck Trudeau"" stuff. Maybe even more so because it's a foreign politician."
mswf69a	funny	weak-tie	[Context Not Found]	Because too many cops are hyper aggressive, asshole bullies. They like to fuck with people just because they can get away with it frequently. They get off on it.
mq23sdw	guitars	strong-tie	[Context Not Found]	Why would anyone want to fuck Trump? Is it because he grabs them by the pussy?
msw0v6a	pics	weak-tie	[Context Not Found]	"If I had a ""Fuck Reagan"" coffee mug, I'd still find it relevant and be using it."
mqso1fu	MechanicalKeyboards	strong-tie	[Context Not Found]	"You don't. You keep buying stuff until you're settled. I think you're a bit overestimating the differences between all of these pieces (you can eliminate whole categories pretty quickly if you start trying stuff), but that doesn't mean you won't still spend tons of money until it's just the way you like. I have like, 14 keyboards or so and a few hundred switches and dozens of keycap sets.

But I've been running the same board for over a year now, have been running cherry profile keycaps for two years now, have been running linears for 3 years now, have been using some sort of metal material for my case and plate for four years now, etc.

Narrows down over time so now I can just keep an eye out for interesting keycap sets (unfortunately a severe decline in these since the pandemic as everything goes for more mass appeal aka boring as fuck), linears similar to my current ones, and any new innovations in the hobby. Those innovations are extremely few and far between, so it's really not much to keep up on now."
mt0860f	pics	weak-tie	He does it because he knows people like you will react. Can’t help yourselves.	And that’s a normal thought process? To just announce how much you love a despot and bait an argument? Fuck is wrong with you guys?
mq4baan	programming	strong-tie	[Context Not Found]	If your setup fucks up because of a blue background, you don't have a computer — you have a toy. Stop blaming Microsoft for your $400 Craigslist potato. Back in 2016, I used a $300 junker with 4mb/s internet, and I still wrote better code than most of you do today. Maybe the problem isn't Windows, maybe it's that you're soft and expect Chrome and VSCode to run like NASA software on decade-old trash. Learn to work with what you've got, or get out of tech.
msed274	guitars	strong-tie	[Context Not Found]	Black Sabbath is not playing Squire guitars... Those are the cheap Fender guitars for beginners and hobby guitar players. Fake as fuck
mt0gf7m	worldnews	weak-tie	[Context Not Found]	As someone who has had cancer. That’s not a good one. At his age. Chemotherapy is not gonna be fun. Fuck Cancer… fight on Joe..
mq6cuwd	linux	strong-tie	[Context Not Found]	"BO6 is currently not linux friendly, and I doubt activision cares enough about linux to support it in the future. Is linux 100% gaming ready? I would say yes, but the issue is that triple-a game companies and anticheat devs just dont care enough to support linux, and some games (rainbow 6 for example) will either refuse to boot if the game detects you're on linux or (gtav online for example) will just ban your account if it sees you playing on linux. Linux itself is perfectly fine and capable especially with proton to run windows applications. 

That being said, its a very small number of games that dont work, and if you really want an alternative solution to dual booting you can always create a windows vm and passthrough your gpu and it'll work just fine. 

Overall though, should you switch to linux? I say fuck it, go for it. I went balls deep and made the switch from windows to fedora in 2021, mainly because my pc was ""too old"" to suppirt windows 11, despite it being a 24 core machine with 128 gigs of ram lol. Proton back then was far more finnicky, and I had to tweak the launch settings for most games to get them to run (and some just didnt at all). Nowadays however, there isnt a single game in my steam library that doesnt just work perfectly fine out of the box on proton 9. Linux gaming has come a long way in the last few years, and its only gonna get better."
mr3dujk	programming	strong-tie	"Oh my God it works.


&gt;Expand this prompt to be more descriptive: I need a program in C# to count numbers.


""I need a C# program that counts numbers within a specified range. The program should allow the user to input a starting number, an ending number, and an optional increment value. It should then display each number in the sequence on a new line. Additionally, the program should handle input validation to ensure the user enters valid integers and that the starting number is less than or equal to the ending number. Include comments in the code to explain each step.""


AI is the future and the future is fuckin' bleak y'all."	Fuck, I should start using that technique too instead of writing multiple sentences on my own lol.
mrdth2a	AskReddit	weak-tie	[Context Not Found]	"Me: I'm hungry and I'm horny, dangerous combo. 
Her: You're always hungry and horny. 
We both get done eating. 
Me: Wanna fuck?
Her: I'm watching Ninjago.
Me: Okay and? I'll put it on the big screen after. 
Her: Sounds good to me."
msxypas	todayilearned	weak-tie	[Context Not Found]	I didn't know humans can get myco :(  I'm glad you made it through, fuck that!
mt3714u	worldnews	weak-tie	[Context Not Found]	Good,  Brexiteers can go fuck themselves. 
mrduhcz	programming	strong-tie	[Context Not Found]	"One matter that is never discussed, but that often kicks companies in the balls, is the network cost of microservices.

By nature, microservices communicate with each other. And the more each service is used, the more it ""talks"" to others. And the more load you have, the more they ""talk"" to each other.

Exponentially.

And while networking is dirt cheap nowadays, exponential curves are what they are. And your much awaited ""scale up moment"" moment may very well cost you tens of thousands in networking. And a slow as fuck application, because your microservices flood each other.

This is slightly less true nowadays, as everyone hosts on cloud platforms. But it's still true that companies never see the flooding and the bills coming..."
msk0521	funny	weak-tie	[Context Not Found]	Ahh? Seriously. ASS! Fuck that idiotic TikTok censorship bullshit.
msxgwvx	worldnews	weak-tie	How many of Hamas leadership is still alive after this from when the war started?	"Mossad doesn't give fuck about anything. Especially not hunting down Hamas. Watch Munich if you want to get an idea how far Mossad is willing to go. 

Its actually a pretty great spy film about the 72 olympic bombings and the subsequent hunt for members of the Black September terrorist group by a group of Mossad agents."
mrdt1jt	Parenting	strong-tie	"&gt; What’s wrong with that?

She’s 13. You’re the adult. Some things have to be led by you. This is one of those things."	"Her daughter is scared. Yes, action needs to be taken, but there's nothing wrong with tempering that reaction and including her daughter in the dialogue and working to get her on board. Going immediately nuclear while her daughter is freaking out about how this will affect her - without taking the time to give her a chance to process it and get on board - could break her trust in her parents. They might ""solve"" this problem only to ensure their daughter never trusts them with problems like this again.

You don't do nothing, but you also don't take a wrecking ball to her trust and wreck the relationship along with the problem. The statute of limitations on what he did is definitely long enough for OP to gain that trust before taking an action that is going to have a profound effect on their daughter's life.

Let's be real about what's going to happen here: she's going to have to talk to police, possibly testify in court, be asked really hard and uncomfortable questions by a defense attorney, she's going to be viewed by a non-zero number of adults in her life as a troublemaker, she's going to become a social pariah at her school, she'll deal with bullying and name-calling and rumors being spread about her, she'll deal with people who will be inexplicably on ***HIS*** side getting in her face and being shitty and bullying her - in short, this is going to ruin school life for her, outside of her true closest friends and those adults who actually give enough of a fuck to care. And we've *already* seen that there's more than a couple of adults in this situation who would rather make it go away than be of any actual help.

Give them a little bit of grace for not being so quick to dismiss how their daughter feels about what's coming. She deserves to have ***at least*** her parents being considerate of her feelings, since nobody else is."
mrdyvmp	AskReddit	weak-tie	[Context Not Found]	Im drinking with my friends. This one coworker should up and bought me a beer cuz i yelled at him cuz he slow as fuck lol
msgx564	funny	weak-tie	[Context Not Found]	I will do everything right and act as polite as possible and I still get yelled at and treated like I’m a special education student. Fuck them.
mt0vt57	worldnews	weak-tie	[Context Not Found]	Fuck yes!
mpfulq5	linux	strong-tie	You should buy a machine, just get a $100 laptop or something	"How? I have 27 cents in my bank account.

I'll win  \~$1000 if Minnesota WIl wins the Stanley Cuo though. SO if you give a fuck about me ( I know you don't), root for Wild regardless, please!"
mqdi8e1	linux	strong-tie	Grub and Linux boot managers are the pinnacle of anti-consumer software. If anyone wants to ever learn how to NOT do things, look at Grub.	What the fuck
mre4c8q	AskReddit	weak-tie	[Context Not Found]	All boring but I just ask my partner, “u wanna fuck?” XD
msva0es	funny	weak-tie	[Context Not Found]	"When you’re like *fuck the world.. *

But just too tired to express it."
mpr61d3	linux	strong-tie	"Windows 10 EOL combined with Windows 11 requiring new hardware means people are left with computers that can't run windows 10 or 11.

Combined with a lot of tools being only now makes it much easier to switch."	It’s the fucking spying! Windows 11 is impossible to secure against MS using undocumented APIs and god knows what the fuck else to phone home and provide who the fuck ever with their best attempt at an accurate dream journal.
mpua6vp	linux	strong-tie	You shouldn't be installing Kali in the first place. Also it's pretty clear the guy is re-installing, not taking 300 days for a single install.	Who the fuck made you god of Kali Linux
mpj8arg	guitars	strong-tie	[Context Not Found]	Option 3. It’s like a briefcase back in the day. You have one, admiration. You open it around friends to their amazement, admiration. He’s a lucky guy. Also, you could wrap it in newspaper and he would give a fuck.
mqwwho7	guitars	strong-tie	"Saying he sucks is like saying that Jeffrey Dahmer had some issues. It's such a wild understatement that it's actually misleading.

Trump more than sucks. Trump is one of the single worst people to ever be US president, and he is going to cause untold suffering to millions by the end of round 2. This is not an exaggeration, just wait until the deportations REALLY get going and his economic ""policy"" really starts hitting home."	"People like you are the reason I am burned out on the fuck trump thing. 


You just take things too far and then they become meaningless. 

You are actually hating on me for not hating trump enough."
mnt7t7u	MechanicalKeyboards	strong-tie	"What would I need to run 103 normal keyboard keys and 15 macro keys, a USB protocol trackball and USB port switched with a physical switch.

Specifically what can run a keyboard and a USB hub all together as the trackball and USB port would be sent through the hub switched between with a physical switch.

I'm attempting to take this from 2008 to 2020 while keeping all original functionality.

https://preview.redd.it/x3b1x50lanve1.jpeg?width=4080&amp;format=pjpg&amp;auto=webp&amp;s=f0d327ca44b35759aaa711dc2302685ae883ed1a"	"an engineering degree and a fuck ton of money and lots and lots of time . 

or a time machine"
mt25w9p	worldnews	weak-tie	[Context Not Found]	"Kailingrad used to be worth something. Now? It isn't worth jack shit

It used to be worth a fuck ton before the Soviet Union knocked everything down and removed the universities and castles and port town.

Now it's just a fucking flat strip with USSR apartment buildings."
mrdy577	AskReddit	weak-tie	"Oh wow... Just a cursory glance at that sub... it is filled with awful people.

AvoidAvoidAvoid"	"Not liking something is completely fine, but *any* time someone makes disliking/hating something a core part of their personality it's a sign of a toxic as fuck person.

Make things you love part of your personality. Not stuff you hate."
msuu9wr	pics	weak-tie	[Context Not Found]	Fuck this garbage. Zero accountability on the cap and trade bullshit so we get slapped with ever-increasing gas taxes
mt0lhw0	pics	weak-tie	It’s beyond politics, it’s a cult	It is 100% a cult. I can't get my parents out of it. They are completely blind to anything crazy he does. I used to consider myself a conservative. It admittedly  took a little  while to break myself out of that mindset but when Trump came along, that sealed the deal for me. I didn't like Biden either but fuck Trump. Fuck all of these dinosaurs man. Im finally starting to see some competent younger talent, but the question is will they actually go for it? I love my parents to death and they're very intelligent people. But for some reason, they just refuse to use any modicum of logic when it comes to Trump. He can do no wrong. It doesn't matter how crazy he looks in his rants about lumberjacks and the travel secretary and riding bikes and climbing trees. It doesn't matter that he's literally pissing all over the constitution they claim to hold so dear. I just dont get it. What the fuck has earned this complete bafoon such die-hard fanaticism?
mr1ubnk	MechanicalKeyboards	strong-tie	They're not blank! They're black on black 😂	I didn't realize that. That's actually cool as fuck.
msp4dqe	funny	weak-tie	[Context Not Found]	Here mom, sit the fuck down
mrzcn07	guitars	strong-tie	[Context Not Found]	Made in Indonesia vs made in Indonesia fuck all difference really buy an S2
mqrdtbg	programming	strong-tie	[Context Not Found]	"The ""sweet spot"" of 12 hours a day. Yes - go work from 9AM to 9PM.

Fuck off."
mriuymi	Parenting	strong-tie	[Context Not Found]	Fuck having more kids.i want hundreds of dogs!
msofwpy	funny	weak-tie	[Context Not Found]	Fly-ing fuck
mntj7au	MechanicalKeyboards	strong-tie	I’ve been on mmd princess tactile v4 for a month and they’ve been my fav. Had U4T, Akko V3 Creamy Blue prior.	"God I love my princesses. I put some in my GMMK pro to liven it up and holy fuck they’re loud. With the Akko clear black keycaps that thing is a machine gun. 

I’d say similar tactility but “feel” shorter throw and definitely need a lube but they’re dope."
msvu6fh	pics	weak-tie	"Correct. This is absolutely no less weird/cringe than all the ""Fuck Trudeau"" stuff. Maybe even more so because it's a foreign politician."	"&gt; Maybe even more so because it's a foreign politician.

I don't think that a ""fuck Putin"" symbol would be weird/cringe in the USA, simply because he is an obvious enemy (as Trump is to Canada)."
mszq43v	todayilearned	weak-tie	[Context Not Found]	"It was her husband trying to pull a power play, from what I could tell.  I came onto the movie during production and was the 2nd Unit Gaffer.  We shot generally when 1st Unit (where she would be used) weren't there.  Close ups of hand, insert stuff, location stuff.  I was brought on by the 1st Unit Gaffer, a friend of mine.  He &amp; the Key Grip (another friend) both had zero good to say about her &amp; her husband for reasons I described.  Pulling power trips and delaying shooting.

All I know is that it was Houma, LA and hot as fuck and the mansion we were shooting in had no A/C so it was even HOTTER as fuck.  The show brought in portable A/C but it was only where the actors were going to be so the techs just had to sweat.  Waiting around for a fucking actor that's sitting in an air conditioned trailer doesn't endear a crew."
mq6zg9h	MechanicalKeyboards	strong-tie	[Context Not Found]	So interested but also, the U.S. tariffs are going to fuck this hobby up so hard for those of us here
